{
  "schema_version": "1",
  "plan_id": "7f3a91",
  "generated_at": "2026-09-03T10:14:22Z",
  "tool_version": "0.1.0",
  "profile": {
    "engine": "exampledb",
    "version": "1.0.0"
  },
  "request": {
    "host": "db-fixture-01.invalid",
    "engine": "exampledb",
    "version": "3",
    "version_source": "requested",
    "environment": "production",
    "instance": "main",
    "port": 6432
  },
  "host": {
    "os": {
      "family": "debian",
      "distro": "ubuntu",
      "version": "24.04",
      "pretty_name": "Ubuntu 24.04.1 LTS",
      "kernel": "6.8.0-45-generic"
    },
    "arch": "x86_64",
    "cpu": { "cores": 8, "model": "fixture" },
    "memory": { "total_bytes": 34359738368, "swap_bytes": 4294967296 },
    "storage": [
      {
        "mount": "/var/lib",
        "free_bytes": 549755813888,
        "total_bytes": 1099511627776,
        "filesystem": "ext4",
        "rotational": false
      },
      {
        "mount": "/backup",
        "free_bytes": 2199023255552,
        "total_bytes": 4398046511104,
        "filesystem": "xfs",
        "rotational": true
      }
    ],
    "time_sync": { "service": "chrony", "synchronized": true }
  },
  "preflight": {
    "summary": { "pass": 14, "warn": 1, "block": 0, "skip": 2 },
    "results": [
      {
        "id": "exampledb.mem.min_total",
        "severity": "block",
        "outcome": "pass",
        "title": "Enough memory to run an instance at all",
        "observed": "32.0 GiB"
      },
      {
        "id": "exampledb.storage.rotational",
        "severity": "warn",
        "outcome": "warn",
        "title": "Data directory on rotational storage",
        "observed": "/backup is rotational",
        "remediation": "Move the backup path to solid state storage if restores are timed."
      }
    ]
  },
  "parameters": [
    {
      "parameter": "cache_size",
      "value": "8GB",
      "rule": "exampledb.cache_size",
      "why": "A quarter of memory is the standard starting point for a shared cache, and it is capped because past that point the operating system page cache is the better place for the memory.",
      "bounded_by": "max"
    },
    {
      "parameter": "max_connections",
      "value": 200,
      "rule": "exampledb.max_connections",
      "why": "A fixed, conservative default. Above four hundred the answer is a connection pooler rather than a larger number here."
    }
  ],
  "layout": {
    "paths": [
      {
        "purpose": "data",
        "path": "/var/lib/basewright/exampledb/main/data",
        "mode": "0700",
        "owner": "exampledb",
        "group": "exampledb",
        "mount": "/var/lib"
      },
      {
        "purpose": "log",
        "path": "/var/log/basewright/exampledb/main",
        "mode": "0750",
        "owner": "exampledb",
        "group": "exampledb"
      }
    ],
    "service_account": {
      "name": "exampledb",
      "group": "exampledb",
      "shell": "/usr/sbin/nologin",
      "create": true
    }
  },
  "changes": [
    { "action": "add", "description": "install exampledb-server-3, exampledb-client-3" },
    { "action": "add", "description": "create service account exampledb" },
    { "action": "modify", "description": "set vm.swappiness", "from": "60", "to": "10" }
  ],
  "secrets": [
    {
      "name": "administrative account password",
      "location": "basewright/db-fixture-01/main/admin"
    }
  ],
  "result": {
    "applicable": true,
    "warnings_require_acknowledgement": true
  }
}
